[
  {
    "order": 1,
    "section": "part2",
    "local_num": 1,
    "id": "part2:1",
    "title": "Condition Of vessel",
    "text": "1. Owners shall exercise due diligence to ensure that from the time when the obligation to proceed to the\nloading port(s) attaches and throughout the charter service -\n(a) the vessel and her hull, machinery, boilers, tanks, equipment and facilities are in good order and\ncondition and in every way equipped and fit for the service required; and\n(b) the vessel has a full and efficient complement of master, officers and crew;\nand to ensure that before and at the commencement of any laden voyage the vessel is in all respects fit to\ncarry the cargo specified in Part I(F). For the avoidance of doubt, references to equipment in this\nCharter shall include but not be limited to computers and computer systems, and such equipment\nshall (inter alia) be required (i) to continue to function, and not suffer a loss of functionality and\naccuracy (whether logical or mathematical) as a result of the run date or dates being processed,\nirrespective of the century in which the dates fall, and (ii) to recognize the year 2000 as a leap year and\naccept 29 February 2000 as a valid date.",
    "page_start": 5,
    "page_end": 5
  },
  {
    "order": 2,
    "section": "part2",
    "local_num": 2,
    "id": "part2:2",
    "title": "Cleanliness Of tanks",
    "text": "2. Whilst loading, carrying and discharging the cargo the Master shall at all times keep the tanks,\nlines and pumps of the vessel always clean for the cargo. Unless otherwise agreed between Owners and\nCharterers the vessel shall present for loading with cargo tanks ready and subject to following\nparagraphs, if vessel fitted with Inert Gas System (IGS), fully inerted.\nCharterers shall have the right to inspect vessel’s tanks prior to loading AT THEIR\nTIME/EXPENSE and the vessel shall abide by Charterers’ instructions with regard to tank or tanks\nwhich the vessel is required to present ready for entry and inspection. If Charterers’ inspector is not\nsatisfied with the cleanliness of the vessel’s tanks, Owners shall clean them in their time and at their\nexpense to the satisfaction of Charterers’ inspector, provided that nothing herein shall effect the\nresponsibilities and obligations of the Master and Owners in respect of the loading, carriage and care\nof cargo under this Charter nor prejudice the rights of Charterers, should any contamination or\ndamage subsequently be found, to contend that the same was caused by inadequate cleaning and/or\nsome breach of this or any other clause of this Charter.\nNotwithstanding that the vessel, if equipped with IGS, shall present for loading with all cargo tanks\nfully inerted, any time used for de-inerting (provided that such de-inerting takes place after laytime or\ndemurrage time has commenced or would, but for this clause, have commenced) and/or re-inerting\nthose tanks that at Charterers’ specific request were gas freed for inspection, shall count as laytime or\nif on demurrage for demurrage AND ALL BUNKERS CONSUMED SHALL BE FOR\nCHARTERERS’ ACCOUNT, provided the tank or tanks inspected found to be suitable.\nIf the vessel’s tanks are inspected and rejected, time used for de-inerting shall not count towards\nlaytime or demurrage, and laytime or demurrage time shall not commence or recommence, as the case\nmay be, until the tanks have been re-inspected SUCH RE-INSPECTION NOT TO BE\nUNREASONABLY DELAYED, approved by Charterers’ inspector, and re-inerted.",
    "page_start": 5,
    "page_end": 5
  },
  {
    "order": 3,
    "section": "part2",
    "local_num": 3,
    "id": "part2:3",
    "title": "Voyage",
    "text": "3. Subject to the provisions of this charter the vessel shall perform her service with utmost despatch and\nshall proceed to such berths as Charterers may specify, in any port or ports within Part I(D) nominated by\nCharterers, or so near thereunto as she may safely get and there, always safely afloat, load a full cargo, but\nnot in excess of the maximum quantity consistent with the International Load Line Convention for the time\nbeing in force and, being so loaded, proceed as ordered on signing bills of lading to such berths as Charterers\nmay specify, in any port or ports within Part I(E) nominated by Charterers, or so near thereunto as she may\nsafely get and there, always safely afloat, discharge the cargo.\nCharterers shall nominate loading and discharging ports, and shall specify loading and discharging berths.\nIn addition Charterers shall have the option at any time of ordering\nthe vessel to safe areas at sea for wireless orders. Any delay or deviation arising as a result of the exercise\nof such option shall be compensated by Charterers in accordance with terms of Clause 26 (1).\nIn this charter, \"berth\" means any berth, wharf, dock, anchorage, submarine line, a position alongside any\nvessel or lighter or any other loading or discharging point whatsoever to which Charterers are entitled to\norder the vessel hereunder, and \"port\" means any port or location at sea to which the vessel may proceed in\naccordance with the terms of this charter.",
    "page_start": 5,
    "page_end": 6
  },
  {
    "order": 4,
    "section": "part2",
    "local_num": 4,
    "id": "part2:4",
    "title": "Safe berth",
    "text": "4. Charterers shall exercise due diligence to order the vessel only to ports and berths which are safe for\nthe vessel and to ensure that transhipment operations conform to standards not less than those set out in the\nlatest edition of ICS / OCIMF Ship-to-Ship Transfer Guide (Petroleum). Notwithstanding anything contained\nin this charter, Charterers do not warrant the safety of any port, berth or transhipment operation and\nCharterers shall not be liable for loss or damage arising from any unsafety if they can prove that due\ndiligence was exercised in the giving of the order,",
    "page_start": 6,
    "page_end": 6
  },
  {
    "order": 5,
    "section": "part2",
    "local_num": 5,
    "id": "part2:5",
    "title": "Freight",
    "text": "5. Freight shall be earned concurrently with delivery of cargo at the nominated discharging port or ports\nand shall be paid by Charterers to Owners without any deductions in United States Dollars at the rate(s)\nspecified in Part I(G) on the gross Bill of Lading quantity as furnished by the shipper (subject to Clauses 8\nand 40), upon receipt by Charterers of notice of completion of final discharge of cargo, provided that no\nfreight shall be payable on any quantity in excess of the maximum quantity consistent with the International\nLoad Line Convention for the time being in force.\nIf the vessel is ordered to proceed on voyage for which a fixed differential is provided in Worldscale,\nsuch fixed differential shall be payable without applying the percentage referred to in Part I(G).\nIf cargo is carried between ports and/or by a route for which no freight rate is expressly quoted in\nWorldscale, then the parties shall, in the absence of agreement as to the appropriate freight rate, apply to\nWorldscale Association (London) Ltd., or Worldscale Association (NYC) Inc. for the determination of an\nappropriate Worldscale freight rate.\nSave in respect of the time when freight is earned, the location of any transhipment at sea pursuant to\nClause 26(2) shall not be an additional nominated port for the purposes of this charter (including this Clause\n5) and the freight rate for the voyage shall be the same as if such transhipment had not taken place.",
    "page_start": 6,
    "page_end": 6
  },
  {
    "order": 6,
    "section": "part2",
    "local_num": 6,
    "id": "part2:6",
    "title": "Dues and other charges",
    "text": "6. Dues and other charges upon the vessel, including those assessed by reference to the quantity of cargo\nloaded or discharged, and shall be paid by Owners, and dues and other\ncharges upon the cargo shall be paid by Charterers. However, notwithstanding the foregoing, where under a\nprovision of Worldscale a due or charge is expressly for the account of Owners or Charterers then such due\nor charge shall be payable in accordance with such provision. NO FREIGHT FAX ON OWNERS\nACCOUNT, AND CHARTERERS TO PAY FREIGHT/DEAD-FREIGHT AND DEMURRAGE NET\nOF TAX TO OWNERS, SUCH TAX BEING CHARTERERS RESPONSIBILITY AND TO BE\nPAID/SETTLED DIRECTLY BY THEM.",
    "page_start": 6,
    "page_end": 6
  },
  {
    "order": 7,
    "section": "part2",
    "local_num": 7,
    "id": "part2:7",
    "title": "Loading and discharging cargo",
    "text": "7. The cargo shall be loaded into the vessel at the expense of Charterers and, upto the vessel's permanent\nhose connections, at Charterers' risk. The cargo shall be discharged from the vessel at the expense of Owners\nand, upto the vessel's permanent hose connections, at Owners' risk. Owners shall, unless otherwise notified\nby Charterers or their agents, supply at Owners' expense all hands, equipment and facilities required on\nboard for mooring and unmooring and connecting and disconnecting hoses for loading and discharging.",
    "page_start": 6,
    "page_end": 6
  },
  {
    "order": 8,
    "section": "part2",
    "local_num": 8,
    "id": "part2:8",
    "title": "Deadfreight",